"Name","position","college","jersey_number","birthday","age","coll_class","height","weight","hs_loc","hs_name","HS_recruitment","background_info","strengths","stats","GP","GS","pass_comp","pass_att","comp_pct","pass_yds","pass_td","qb_int","rush_att","rush_yds","rush_ypc","rush_TD","rec","rec_yds","rec_ypc","rec_TD","tackles","tfl","sacks","forced_fumbles","passes_defended","def_int","arm_length","hand_size","wingspan","forty_dash","twenty_shuttle","ten_split","vert_jump","broad_jump","short_shuttle","three_cone","bench","season","draft_year","draft_team","draft_round","draft_ovr","pfr_id"
"COLE HOLCOMB","LB","North Carolina",36,"6/30/1996","22.83","rSR",73.25,231,"New Smyrna Beach, Fla.","NSB",0,"A no-star recruit out of high school, Cole Holcomb, who was born in Charlotte, was a two-sport letterman at New Smyrna Beach (high school teammate of 2019 safety prospect D’Cota Dixon), playing football and soccer. He played mostly safety and tight end and earned Second Team All-County as a senior. Holcomb received one FBS-level scholarship (Air Force) and several offers from FCS-level programs, but he wanted to play in a power-five conference. He originally agreed to walk on at Duke, but that fell through and he was left scrambling to find a team. North Carolina took a chance and he redshirted in 2014 and earned a starting role in 2016, leading the team in tackles three straight years. Holcomb accepted his invitation to the 2019 East-West Shrine Game.","Above-average athleticism with play speed that matches his timed speed…plus lateral range, mirroring the running back to the hole…gap sound due to outstanding eyes and anticipation…intelligence like his is mandatory for the position…sees through blockers…rarely fooled by eye candy and won’t take himself out of plays…drops his pads and fills to take on lead blockers…determined chaser and unleashes violence as a tackler…refuses to be out-worked and can be trusted to give top effort each down…consistently productive and averaged 8.9 tackles per start the last three seasons.","YEAR (GP/GS) TKLS       TFL     SACK    FF      PD     INT      NOTES 2014: Redshirted 2015: (14/0)    15      0.0     0.0     0       0      0 2016: (13/13) 115       5.0     1.0     0       5      0 2017: (11/11) 93        2.5     0.5     0       3      0 2018: (11/10) 105       8.0     1.0     4       4      0        Second Team All-ACC Total: (49/34) 328      15.5    2.5     4       12     0               HT      WT ARM            HAND          WING       40-YD 20-YD 10-YD       VJ        BJ        SS     3C       BP COMBINE      N/A (not invited) PRO DAY      6012 231 31 3/8           09 7/8        77 1/4     4.51    2.63   1.59     39 1/2    11’00”    4.14   6.77     22    (vertical result is from Regional Combine)                                                                                          [164]  ",11,10,.,.,.,.,.,.,.,.,.,.,.,.,.,.,105,8,1,4,4,0,.,.,.,.,.,.,.,.,.,.,.,.,.,.,.,.,.
"SUTTON SMITH","LB","Northern Illinois",15,"3/22/1996","23.11","rJR",72.375,233,"Saint Charles, Mo.","Francis Howell",3,"A three-star linebacker recruit out of high school, Sutton Smith was a standout running back at Francis Howell. After posting 1,682 all-purpose yards as a junior, he rushed for over 2,000 rushing yards as a senior, finishing with 2,456 all-purpose yards in 2014 to earn All-Metro Offensive Player of the Year honors. Smith played one game on defense in his prep career and it was based on that performance (22 tackles vs. Cincinnati Elder) that he received an offer from Northern Illinois, his only FBS-level offer. He broke his hand at a recruiting camp and that limited his exposure as a recruit, receiving only one other Division-I offer from FCS- level Austin Peay. Northern Illinois stayed open minded to Smith playing running back in college, but they recruited him on defense and he accepted the change. His father (Chuck) played football at Middle Tennessee State and his mother (Sandy) played volleyball collegiately at Missouri State. Smith proposed to his girlfriend (Julie) on the field after the 2018 MAC Championship Game. He elected to skip his final season of eligibility and enter the 2019 NFL Draft. With his degree in hand, Smith accepted his invitation to the 2019 Senior Bowl.","Terrific body control and dip off the edge…smooth sink in his plant-and-go to make sharp 90-degree turns (best 3-cone time at the combine among front-seven defenders)…active hands in his rush to fight off jabs…quickly finds his speed in pursuit…physical tackler and strikes with violence…competes with boundless energy…recorded two blocks on special teams and scored four touchdowns the last two seasons (three fumble returns, one punt block return)…graduated with a degree in communications (December 2018)…committed to his craft with an intense work ethic…remarkable backfield production the last two seasons, becoming the first player in school history to twice earn First Team All-American honors.","YEAR (GP/GS) TKLS       TFL    SACK     FF    PD    INT    NOTES 2015: Redshirted 2016: (12/0)    15      2.0    1.0      0     0     0 2017: (13/13) 63        29.5   14.0     3     3     0      Consensus All-American; MAC Defensive Player of the Year; First Team All-MAC 2018: (13/13) 56        24.5   15.0     4     1     0      First Team All-American; MAC Defensive Player of the Year; First Team All-MAC Total: (38/26) 134      56.0   30.0     7     4     0              HT      WT ARM           HAND         WING     40-YD 20-YD 10-YD          VJ        BJ        SS     3C       BP COMBINE     6003 233 30 3/4 09                    73 1/2   4.69  2.78  1.72           31 1/2    09’10”    4.32   6.75     25 PRO DAY     N/A (did not work out – choice)  ",13,13,.,.,.,.,.,.,.,.,.,.,.,.,.,.,56,24.5,15,4,1,0,30.75,9,73.5,4.69,2.78,1.72,31.5,118,4.32,6.75,25,2019,2019,"Pittsburgh Steelers",6,175,"SmitSu00"
"DREW LEWIS","LB","Colorado",20,"9/7/1995","23.65","rSR",74.25,229,"Sammamish, Wash.","Eastlake",3,"A three-star safety recruit out of high school, Drew Lewis, who was born in Atlanta and started playing football in sixth grade, played football and ran track at Sammamish’s Eastlake, just outside of Seattle. He ran sprints and relays with personal-bests in the 100-meters (10.93) and 200-meters (22.10). Lewis played both ways for Eastlake, rushing for 1,200 yards and 16 touchdowns as a senior, adding 45 tackles and two interceptions as a safety on defense. Recruited mostly as a defensive player, he was the No. 11 recruit in the state of Washington in the 2014 class and committed to the Huskies over Arizona State and Pittsburgh. Lewis was part of Chris Petersen’s first recruiting class at Washington, but never played in a game there. He redshirted in 2014 and was dismissed from the program prior to the 2015 season for a violation of team rules. He resurfaced at Coffeyville Community College, playing in just five games in 2015 due to injury. Lewis was hoping to rejoin a power-five program and Colorado gave him that chance (Utah State and Memphis were his only other offers). His twin brother (Troy, who is six minutes younger)                                                                                       was a preferred walk-on for the Buffs in 2016; his older brother (Ryan) played cornerback at Pittsburgh (went undrafted in 2017) and saw action for the Buffalo Bills in 2018; his father (Will) played cornerback for the Seattle Seahawks and spent 20 years as a NFL scout and personnel man (was most recently the general manager of the AAF’s Memphis Express); he has several other family members who played professionally, including his cousin (Louis Riddick), who played six years in the NFL and is currently an ESPN analyst. Lewis accepted his invitation to the 2019 East-West Shrine Game.","Top-tier athlete with lower body explosion…above-average speed to make plays at both sidelines…nimble feet to slip blocks or capture the corner as a blitzer…able to dip, loop and beat blocks as an edge rusher…strong hands to quickly corral and ground the ballcarrier…decleats runners with his lead shoulder…opens his hips to drop and cover ground vs. the pass…experienced on special teams coverages…grew up around the game with unique family bloodlines…started at inside linebacker before moving outside as a senior.","YEAR (GP/GS) TKLS TFL SACK FF PD                      INT    NOTES 2014: Redshirted                                             Washington 2015: Coffeyville Community College (Kan.) 2016: (13/0)     8    1.0    1.0      1    1          0      Colorado 2017: (12/12) 119 4.0        2.0      0    4          0      Colorado 2018: (12/6)     66   6.0    2.0      0    5          1      Colorado Total: (37/18) 193 11.0 5.0           1    10         1              HT      WT ARM            HAND          WING     40-YD 20-YD 10-YD       VJ        BJ        SS     3C       BP COMBINE     N/A (not invited) PRO DAY     6022 229 32               10            77 1/2   4.51    2.63   1.63     34        10’09”    4.30   7.01     20  ",12,6,.,.,.,.,.,.,.,.,.,.,.,.,.,.,66,6,2,0,5,1,.,.,.,.,.,.,.,.,.,.,.,.,.,.,.,.,.
"KADEN ELLISS","LB","Idaho",3,"7/10/1995","23.81","rSR",74.25,238,"Salt Lake City, Utah","Judge Memorial",0,"A no-star recruit out of high school, Luther “Kaden” Elliss, who is the oldest of 12 children (seven adopted), played quarterback at Judge Memorial Catholic and led the program to the 2013 state championship (the first for the program in 30 years). As a senior, he threw for 714 yards, rushed for 921 yards and scored 25 total touchdowns (nine passing, 16 rushing), earning the Utah High School Most Valuable Player Award. He also saw time on defense, mostly at safety where he recorded 52 tackles and one interception. Elliss hoped to played quarterback collegiately at Utah (his parents alma mater), but Idaho was his only FBS-level scholarship offer and that was a grayshirt opportunity (Idaho moved to the FCS-level in 2017). He moved to defense in college and played a variety of linebacker roles for the Vandals. Elliss’ father (Luther) was a consensus All-American defensive tackle at Utah in 1994 and was a first-rounder (No. 20 overall) in the 1995 NFL Draft, playing 10 seasons in the NFL (nine for the Detroit Lions). He was the team chaplain for the Denver Broncos before serving as the Idaho defensive line coach the past two seasons. Elliss’ mother (Rebecca) was a swimmer at Utah. His younger brother (Christian) plays linebacker at Idaho and led the team in tackles in 2018. Elliss married former Idaho basketball player (Brooke Reilly) in the summer of 2018.","Energetic athlete…field fast with bursts of momentum, both immediate and when closing…uses speed to win the edge, shave the corner and affect the pocket…fluid lower body to sink and redirect…aggressive punch to create knock-back at contact…sets a hard edge in the run game…forceful tackler and arrives with thump…improved zone drops with speed to stick with backs or tight ends in man-coverage…intense competitive nature with a relentless play style…four-year starter with experience all over the front-seven.","YEAR (GP/GS) TKLS       TFL    SACK     FF     PD     INT    NOTES 2014: Grayshirted 2015: (12/10) 83        8.0    1.0      0      0      0 2016: (13/13) 65        8.0    3.0      3      7      5      All-Sun Belt Honorable Mention 2017: (12/12) 80        16.0   6.0      2      4      0      Second Team All-Big Sky 2018: (11/11) 60        16.0   7.0      1      3      0      First Team All-Big Sky Total: (48/46) 288      48.0   17.0     6      14     5              HT      WT ARM            HAND          WING     40-YD 20-YD 10-YD       VJ        BJ        SS     3C       BP COMBINE     N/A (not invited) PRO DAY     6022 238 32 3/4           10 1/2        79 1/2   4.65    2.71   1.63     34 1/2    10’0”     4.13   6.63     20    (participated at Utah and Idaho pro days)  ",11,11,.,.,.,.,.,.,.,.,.,.,.,.,.,.,60,16,7,1,3,0,.,.,.,.,.,.,.,.,.,.,.,.,.,.,.,.,.
"SIONE TAKITAKI","LB","BYU",16,"6/8/1996","22.89","rSR",73.125,238,"Fontana, Calif.","Heritage",3,"A three-star fullback recruit out of high school, Sione (See-OH-nay) Takitaki (TOCK-ee-TOCK-ee), who also played volleyball in high school, played both ways at Heritage. He was a three-year starter at linebacker and recorded 193 tackles, 42.5 tackles for loss and 21.5 sacks, earning Defensive Player of the Year honors as a senior. Takitaki was also a bruiser at running back and totaled 1,673 rushing yards (7.1 average) and 25 touchdowns over his final two prep seasons. He was recruited for offense and defense and committed to BYU as a linebacker over offers from Arizona, Washington State and Wisconsin. Takitaki came off the bench his first two seasons, but ran into off-field issues and multiple suspensions, redshirting in 2016. He stayed out of trouble and developed into the team’s top defensive player the last two seasons. Takitaki married his wife (Alyssa, former BYU swimmer) in June 2016. He accepted his invitation to the 2019 East-West Shrine Game and was a late addition to the 2019 Senior Bowl.","Mirrors well vs. the run with his backfield vision and pursuit speed…bursts into blockers with a sharp punch to stun and unwind…doesn’t shy from contact, fighting and clawing to get ballcarriers on the ground…bursts downhill and recorded more tackles for loss (32.5) than starts (27) over his career…makes the playbook come alive with his aggressive motor…experienced at multiple positions in the front-seven…senior captain and rebuilt his image into a veteran leader over his collegiate career.","YEAR (GP/GS) TKLS       TFL     SACK    FF     PD   INT   NOTES 2014: (11/0)    19      4.0     3.0     1      0    0 2015: (6/2)     21      7.0     3.5     0      0    0     EDGE 2016: Redshirted 2017: (13/12) 79        12.5    5.0     0      2    0     EDGE 2018: (13/13) 118       9.0     3.0     1      3    0     OLB/MLB; Team Captain Total: (43/27) 237      32.5    14.5    2      5    0              HT      WT ARM         HAND WING 40-YD 20-YD 10-YD                       VJ        BJ        SS     3C      BP COMBINE     6011 238 32            09 5/8 75 3/8 4.63          2.70 1.60             37        10’05”    4.28   7.21    24 PRO DAY     N/A (stood on Combine numbers; positional drills only)  ",13,13,.,.,.,.,.,.,.,.,.,.,.,.,.,.,118,9,3,1,3,0,32,9.625,75.375,4.63,2.7,1.6,37,125,4.28,7.21,24,2019,2019,"Cleveland Browns",3,80,"TakiSi00"
"RYAN CONNELLY","LB","Wisconsin",43,"10/23/1995","23.52","rSR",74.125,242,"Eden Prairie, Minn.","Eden Prairie",0,"A no-star recruit out of high school, Ryan Connelly was a three-year starting quarterback at Eden Prairie, leading the program to three straight Class 6A state championships his sophomore, junior and senior seasons. He finished his senior season with 14 touchdowns and no interceptions, but Eden Prairie was a run-heavy offense that focused on him handing the ball to a stable of backs. Connelly was also a three-year letterman in lacrosse, which kept him from attending too many football camps. As a recruit, he didn’t have any Division-I offers and jumped at the only opportunity he received (walk-on spot at Wisconsin) over playing Division II or III in Minnesota. Connelly didn’t have any delusions about playing quarterback in the Big Ten and added 30 pounds to his frame, forcing a move to linebacker on the scout team. He impressed enough during his redshirt year to earn a scholarship prior to the 2015 season. Midway through his senior year, Connelly found out that his mother (Christi) was diagnosed with lung cancer and he is now involved in raising money for cancer research. He accepted his invitation to the 2019 East-West Shrine Game, but was unable to play due to injury.","Quick read/react skills…breaks down plays quickly, giving himself a head start…plays with burst to the football…speed looks the same on every snap and is enough to make plays at the sideline…finds a way to harmonize his discipline and aggression, using both as assets…violent play style and looks to drive through his target…played through a core/abdominal injury as a senior…graduated with a degree in economics (December 2018)…former walk-on and didn’t take long to earn a scholarship…coaches say he has a relentless commitment to his craft.","YEAR (GP/GS) TKLS       TFL     SACK    FF     PD   INT   NOTES 2014: Redshirted 2015: (13/0)    15      1.0     0.0     0      0    0 2016: (14/8)    59      7.0     0.0     0      4    1 2017: (14/6)    88      11.0    3.0     1      2    1     All-Big Ten Honorable Mention 2018: (12/12) 89        10.0    3.0     1      1    0     Third Team All-Big Ten Total: (53/26) 251      29.0    6.0     2      7    2              HT       WT       ARM      HAND        WING   40-YD 20-YD 10-YD          VJ        BJ        SS     3C      BP COMBINE     6021     242      30 7/8   9 3/8       75     4.66  2.74  1.62           34 1/2    09’10”    4.31   7.09    -     (no bench press – choice) PRO DAY                                                   -     -     -              -         -         4.15   -       17    (stood on Combine runs, jumps, 3-cone)                                                                                      [167]  ",12,12,.,.,.,.,.,.,.,.,.,.,.,.,.,.,89,10,3,1,1,0,30.875,9.375,75,4.66,2.74,1.62,34.5,118,4.31,7.09,.,2019,2019,"New York Giants",5,143,"ConnRy00"
"DAKOTA ALLEN","LB","Texas Tech",40,"11/2/1995","23.49","rSR",72.75,232,"Humble, Texas","Summer Creek",3,"A three-star linebacker recruit out of high school, Dakota Allen was a three-year starting middle linebacker at Summer Creek. After posting 103 tackles as a junior, he finished with 112 tackles and three interceptions as a senior in 2013, earning District MVP honors. Allen was the No. 100 recruit in the state of Texas and received offers from Kansas State, Oklahoma, TCU and Texas Tech, committing to the Red Raiders. After redshirting in 2014, he was a key piece of the Tech defense in 2015. However, he was arrested during the 2016 offseason on a second-degree felony count of burglary of a habitation and subsequently dismissed from the program. Allen enrolled at East Mississippi Community College for the 2016 season where he was featured on the Netflix original series “Last Chance U.” He was given the opportunity to return to Texas Tech in June 2017. Allen’s father (Keith) was a running back at the University of Texas. Allen received an invitation to the 2019 NFLPA Collegiate Bowl, but declined.","Quick to key, read and diagnose vs. the run, understanding blocking schemes…quick feet and lateral slide to avoid blocks…sees through bodies and doesn’t lose sight of the ball…determined chaser with adequate range for the position…calms his feet and surges into his targets to create physical tackles…tracks the eyes of the quarterback and sniffs out screens…two-year team captain and battled back from self-created adversity…well-liked by his teammates and coaches (former Texas Tech head coach Kliff Kingsbury: “He’s been great for our program”).","YEAR (GP/GS) TKLS TFL SACK FF                  PD    INT     NOTES 2014: Redshirted                                             Texas Tech 2015: (12/5)     87     6.0 0.0      0         3     2       Texas Tech 2016: East Mississippi Community College 2017: (13/13) 102 6.0       2.0      1         6     2       Texas Tech; Second Team All-Big 12; Team Captain 2018: (11/11) 73        6.5 0.5      0         2     0       Texas Tech; First Team All-Big 12; Team Captain Total: (36/29) 262 18.5 2.5          1         11    4              HT       WT     ARM       HAND          WING     40-YD 20-YD 10-YD       VJ        BJ        SS     3C       BP COMBINE     6006     232    31 1/4    09 1/4        74       4.77  2.77  1.67        31 1/2    09’08”    4.04   6.88     23 PRO DAY                                                      4.82  2.79  1.61        34 1/2    09’11”    -      -        -     (stood on Combine shuttles, bench)  ",11,11,.,.,.,.,.,.,.,.,.,.,.,.,.,.,73,6.5,0.5,0,2,0,31.25,9.25,74,4.77,2.77,1.67,31.5,116,4.04,6.88,23,2019,2019,"Los Angeles Rams",7,251,"AlleDa01"
"TYREL DODSON","LB","Texas A&M",25,"6/25/1998","20.85","JR",72.375,237,"Franklin, Tenn.","Centennial",3,"A three-star linebacker recruit out of high school, Tyrel Dodson was a two-way player at Centennial, starring at linebacker and running back. After posting 74 tackles and 8.0 sacks as a junior, he recorded 111 tackles, 32.0 tackles for loss, 8.0 sacks and two interceptions, adding 545 rushing yards and 15 scores on offense. Dodson earned First Team All-State honors and was runner-up for Class 5A Mr. Football Lineman of the Year, but was given the award after the finalist was charged with domestic assault. He ranked as the No. 14 inside linebacker in the 2016 recruiting class, committing to Texas A&M over Arkansas, Kentucky and Missouri. Dodson chose to skip his senior season and enter the 2019 NFL Draft.","Looks the part and commits himself in the weight room…active feet to scrape down the line of scrimmage and avoid collisions…initial quickness to sidestep blockers…leverages blocks in the hole…upper body strength to give blockers all they can handle as a blitzer…peels off blocks and contains…smooth ability to turn, run and track the football…considered a first-class individual with reliable personal and football character…evolved into a team leader and was responsible for making the defensive calls as a junior…played in all 39 games the last three seasons.","YEAR (GP/GS)     TKLS   TFL    SACK    FF      PD    INT     NOTES 2016: (13/0)     27     1.5    0       0       0     0 2017: (13/13)    105    11.0   5.5     0       11    3 2018: (13/13)    70     7.0    0.5     0       4     1 Total: (39/26)   202    19.5   6.0     0       15    4                                                                                      [168]              HT       WT      ARM      HAND          WING     40-YD 20-YD 10-YD       VJ        BJ       SS     3C      BP COMBINE     6003     237     31 3/4   09 1/8        75 3/4   4.60  2.68  1.61        -         09’10”   -      -       24    (no vertical, shuttle or 3-cone – choice) PRO DAY                                                      -     -     -           35        -        4.50   7.59    -     (stood on Combine runs, broad, bench)  ",13,13,.,.,.,.,.,.,.,.,.,.,.,.,.,.,70,7,0.5,0,4,1,31.75,9.125,75.75,4.6,2.68,1.61,.,118,.,.,24,2019,.,.,.,.,"DodsTy01"
"JOE GILES-HARRIS","LB","Duke",44,"4/1/1997","22.08","rJR",73.75,234,"Nyack, N.Y.","St. Joseph Regional",3,"A three-star linebacker recruit out of high school, Joe Giles-Harris was a three-sport letterman at St. Joseph Regional (N.J.), playing basketball, football and lacrosse. He was part of back-to-back state championships his sophomore and junior seasons and earned First Team All-League, All-Metro and All-State honors as a senior, finishing with 95 tackles, 3.0 sacks and four interceptions. Giles-Harris also saw time on offense with 24 catches for 315 yards and two scores. He ranked as the No. 54 linebacker in the 2015 recruiting class and committed to Duke over Boston College, Northwestern and others. Giles-Harris’ father (John) played football at Southern Connecticut and his mother (Lynn) was a runner and soccer player at SUNY Geneseo; his older brother (William) played linebacker at Gannon and his younger brother (J.T.) is a lacrosse player at Duke. Giles-Harris elected to skip his senior season and enter the 2019 NFL Draft.","Well-built, sturdy size…quick to diagnose, mirror and make plays in the run game…adjusts well downhill in pursuit…physical tackler, striking with pop behind his pads…strong hands to finish off-balance tackle attempts…competes with urgency…well-conditioned athlete and rarely came off the field, averaging 68.4 snaps per game over his career…consistently productive and leaves Duke as one of only five players in school history with 300-plus tackles and 30-plus tackles for loss.","YEAR (GP/GS) TKLS      TFL     SACK    FF      PD     INT    NOTES 2015: Redshirted 2016: (12/12) 107      9.5     4.0     0       3      1      Freshman All-American; ACC Rookie of the Year runner-up 2017: (13/13) 125      16.0    4.5     1       5      1      Second Team All-American; First Team All-ACC 2018: (9/9)     81     7.0     1.0     0       2      0      First Team All-ACC Total: (34/34) 313     32.5    9.5     1       10     2              HT       WT      ARM      HAND          WING     40-YD 20-YD 10-YD       VJ        BJ       SS     3C      BP COMBINE     6016     234     31 1/4   08 1/2        75 3/8   4.75  2.79  1.68        29 1/2    09’03”   -      -       17    (no shuttle or 3-cone – choice) PRO DAY                                                      -     -     -           -         -        4.40   7.09    -     (stood on Combine runs, jumps, bench)  ",9,9,.,.,.,.,.,.,.,.,.,.,.,.,.,.,81,7,1,0,2,0,31.25,8.5,75.375,4.75,2.79,1.68,29.5,111,.,.,17,2019,.,.,.,.,"GileJo01"
