"Name","position","college","jersey_number","birthday","age","coll_class","height","weight","hs_loc","hs_name","HS_recruitment","background_info","strengths","stats","GP","GS","pass_comp","pass_att","comp_pct","pass_yds","pass_td","qb_int","rush_att","rush_yds","rush_ypc","rush_TD","rec","rec_yds","rec_ypc","rec_TD","tackles","tfl","sacks","forced_fumbles","passes_defended","def_int","arm_length","hand_size","wingspan","forty_dash","twenty_shuttle","ten_split","vert_jump","broad_jump","short_shuttle","three_cone","bench","season","draft_year","draft_team","draft_round","draft_ovr","pfr_id"
"STANLEY MORGAN","WR","Nebraska",8,"9/7/1996","22.64","SR",72,202,"New Orleans, La.","St. Augustine",3,"A three-star wide receiver recruit out of high school, Stanley Morgan Jr., who also played high school basketball, was a three-year starting wideout at St. Augustine, where he was teammates with Jacksonville Jaguars running back Leonard Fournette. After posting 66 catches for 1,077 yards and 13 touchdowns as a junior, he recorded 46 receptions for 891 yards and eight scores as a senior, earning 2014 First Team All-State honors. Morgan was the No. 53 receiver recruit in the 2015 class and surprised many when he committed to Nebraska over offers from Clemson, Florida, Georgia, Ohio State and others. He is not related to former NFL Pro Bowl wide receiver Stanley Morgan.","Good-sized athlete with length to extend outside his frame…balanced route runner and doesn’t allow corners to get him off-schedule…smooth stem work, using coordinated sink…strong hands and aggressively attacks the catch point…natural tracking skills downfield…walks the tightrope along the sideline, before and after the catch…able to lock up defenders as a blocker…senior captain who isn’t afraid to speak up on the sideline or in the locker room…production increased each season, finishing his career as the only player in school history to eclipse 950 receiving yards in a season (did it twice).","YEAR (GP/GS)     REC     YDS     AVG      TD      NOTES 2015: (13/3)     25      304     12.2     3 2016: (13/9)     33      453     13.7     2 2017: (11/8)     61      986     16.2     10      Second Team All-Big Ten 2018: (12/12)    70      1,004   14.3     7       Second Team All-Big Ten; First Nebraska player to eclipse 1,000 receiving yards in a season Total: (49/32)   189     2,747   14.5     22              HT      WT ARM         HAND WING 40-YD 20-YD 10-YD                      VJ        BJ        SS     3C      BP COMBINE     6000 202 32 3/8 09 7/8 78 1/8 4.53                 2.66 1.58            38 1/2    10’05”    4.13   6.78    14 PRO DAY     N/A (stood on Combine numbers; positional drills only)  ",12,12,.,.,.,.,.,.,.,.,.,.,70,1004,14.342857142857143,7,.,.,.,.,.,.,32.375,9.875,78.125,4.53,2.66,1.58,38.5,125,4.13,6.78,14,2019,.,.,.,.,"MorgSt02"
"KEELAN DOSS","WR","Cal-Davis",3,"3/21/1996","23.11","rSR",74.125,211,"Alameda, Calif.","Alameda",0,"A no-star wide receiver recruit out of high school, Keelan Doss was a two-sport letterman at Alameda, playing basketball and football. He was a three- year starting wide receiver but missed most of his junior year with a foot injury and missed three games as a senior captain, finishing his final prep season with 29 catches for 577 yards and nine touchdowns. As a recruit, Doss talked with several Pac-12 and Mountain West programs, but his injuries took him off their radar, receiving only a walk-on opportunity at Fresno State. However, FCS-level Cal-Davis offered early and didn’t waver through the injuries. Doss accepted his invitation to the 2019 Senior Bowl.","Big-bodied frame with good play strength…precision route-runner and understands how to uncover…efficient sink-and-drive action at the top of routes…excellent hand strength to extend and finish away from his body…tracks the football well and maintains his focus through the catch…high football IQ and relays his cover reads to the play caller for the next drive…highly productive with 115-plus catches and 1,300-plus receiving yards each of the last two seasons.","YEAR (GP/GS) REC        YDS      AVG      TD      NOTES 2014: (10/2)    22      325      14.8     2 2015: Redshirted 2016: (11/11) 66        911      13.8     10      Second Team All-Big Sky 2017: (11/11) 115       1,499    13.0     7       Consensus All-American; Big Sky Offensive Player of the Year; First Team All-Big Sky 2018: (13/13) 118       1,334    11.3     9       Consensus All-American; First Team All-Big Sky Total: (45/37) 321      4,069    12.7     28              HT       WT       ARM       HAND     WING     40-YD 20-YD 10-YD         VJ        BJ        SS     3C       BP COMBINE     6021     211      31 3/4    09 1/2   77 1/8   -     -     -             -         -         -      -        -    (injured left pectoral during bench press) PRO DAY                                                   4.52  2.62  1.58          36        10’04”    -      -        -  ",13,13,.,.,.,.,.,.,.,.,.,.,118,1334,11.305084745762711,9,.,.,.,.,.,.,31.75,9.5,77.125,.,.,.,.,.,.,.,.,.,.,.,.,.,.
"HUNTER RENFROW","WR","Clemson",13,"12/21/1995","23.36","rSR",70.25,184,"Myrtle Beach, S.C.","Socastee",0,"A no-star recruit out of high school, Hunter Renfrow played for his head coach father in a triple-option offense at Socastee High, sharing the quarterback duties with his brother (Jordan) as a sophomore. He became the full-time starter for his final two seasons at the prep level, earning All-State honors as a senior with 1,421 rushing yards and 26 touchdowns. At 5-10 and 150 pounds, Renfrow went overlooked as an FBS recruit, receiving offers only from FCS-level programs like Appalachian State. He attended a camp at Clemson and was offered a preferred walk-on opportunity, which he quickly accepted. Renfrow had several family connections to the school with his mother (Suzanne), brother (Jordan) and grandfather (Harold Clemmons) all Clemson alums. He was also a standout prep baseball player and received several collegiate scholarship offers. Renfrow’s father (Tim), who coached at Socastee for 10 years (2003-12), was a prolific shortstop and cornerback at Wofford College and still holds the career records for stolen bases (84) and interceptions (19). His younger brother (Cole) is a walk-on tight end at Clemson. He accepted his invitation to the 2019 Senior Bowl.","Gorgeous route runner…quick, composed feet with no wasted motion at the stem…creates separation with his technique and timing, skillfully using head bobs and body fakes…always runs routes to proper depth, finding the sticks…above average hand-eye coordination and strong finisher…tough over the middle to secure fastballs and bounce back from hits…high IQ pass catcher…innate sideline and spatial awareness…graduated with a degree in economics (May 2018)…will win over a coaching staff with his elite work ethic and practice habits, earning a scholarship before he even played a game (April 2015)…set the Clemson records for starts by a receiver (47) and consecutive games with a catch (43).                                                                                      [51]","YEAR (GP/GS) REC        YDS      AVG      TD      NOTES 2014: Redshirted 2015: (15/10) 33        492      14.9     5 2016: (11/9)    44      495      11.2     6 2017: (14/13) 60        602      10.0     3       Third Team All-ACC 2018: (15/15) 49        544      11.1     1       Third Team All-ACC; Burlsworth Trophy (Nation’s top walk-on); Team Captain Total: (55/47) 186      2,133    11.5     15              HT       WT       ARM       HAND     WING     40-YD 20-YD 10-YD         VJ        BJ        SS     3C       BP COMBINE     5102     184      29 1/8    07 7/8   70 3/4   4.59  2.69  1.64          35        09’08”    4.19   6.80     7 PRO DAY     N/A  ",15,15,.,.,.,.,.,.,.,.,.,.,49,544,11.10204081632653,1,.,.,.,.,.,.,29.125,7.875,70.75,4.59,2.69,1.64,35,116,4.19,6.8,7,2019,2019,"Oakland Raiders",5,149,"RenfHu00"
"ANTOINE WESLEY","WR","Texas Tech",4,"10/22/1997","21.52","JR",76.125,206,"Las Vegas, Nev.","Cibolo Steele",3,"A three-star wide receiver recruit out of high school, Antoine Wesley (formerly Cox-Wesley) was a two-year starting wideout at Cibolo Steele. After six touchdown catches as a junior, he posted 48 catches for 670 yards and 11 touchdowns as a senior, earning All-District honors. Wesley also ran high school track and finished second in regionals in the long jump (22-2 3/4). He wasn’t ranked as a recruit when Texas Tech extended him an offer, which was the lone FBS-level scholarship he received. The coaches hoped to redshirt him in 2016, but injuries at wide receiver ended that idea. After his breakout 2018 season, Wesley elected to skip his senior season and enter the 2019 NFL Draft.","Loose-jointed and doesn’t move stiff…long body to extend outside his frame with reliable ball skills…skilled at climbing the ladder and making difficult catches look routine…picks up speed once he stretches out his long strides…capable of sharp, decisive cuts at top speed…fleet of foot to sidestep tackle attempts and tightrope the sideline…led the FBS with 17 catches of 30-plus yards in 2018…led the Big 12 in catches (88) and his 1,410 receiving yards is the third most in a single season in Texas Tech history.","YEAR (GP/GS)     REC     YDS     AVG      TD      NOTES 2016: (4/1)      0       0       0.0      0 2017: (13/0)     10      137     13.7     0 2018: (12/12)    88      1,410   16.0     9       First Team All-American; Second Team All-Big 12; Second in the FBS in receiving yards per game (117.5) Total: (29/13)   98      1,547   15.8     9              HT         WT    ARM        HAND     WING     40-YD 20-YD 10-YD           VJ        BJ        SS     3C       BP COMBINE     6041       206   34         09 3/4   79 3/4   -     -     -               37        09’09”    4.26   7.07     6     (no runs – choice) PRO DAY                                                   4.67  2.77  1.69            -         -         -      -        -     (stood on Combine jumps, shuttles, bench)  ",12,12,.,.,.,.,.,.,.,.,.,.,88,1410,16.022727272727273,9,.,.,.,.,.,.,34,9.75,79.75,.,.,.,37,117,4.26,7.07,6,2019,.,.,.,.,"WeslAn01"
"CODY THOMPSON","WR","Toledo",25,"1/11/1996","23.30","rSR",73.5,205,"Huron, Ohio","Huron",2,"A two-star wide receiver recruit out of high school, Cody Thompson was a standout basketball and football player at Huron. He was a wide receiver as a sophomore (48 catches for 865 yards and 11 touchdowns) before moving to quarterback for his final two prep seasons. He finished his senior year with 1,883 passing yards, 1,139 rushing yards and 39 total touchdowns, earning Second Team All-District honors. He was rated as the No. 413 wide receiver in the 2014 recruiting cycle and received only one FBS-level offer, committing to Toledo as a wideout. Thompson received a medical redshirt after breaking his right leg midway through the 2017 season. He accepted his invitation to the 2019 East-West Shrine Game.","Solidly built athlete…runs every route in the playbook and from different alignments…steady hands and hand-eye coordination…mixes gears mid-route and efficiently transitions his weight in/out of his breaks…subtle quickness after the catch to throw defenders off balance in space…gas tank is never on empty, always working to uncover or fighting for extra yards…experienced on various special teams coverages, blocking a punt in 2018 (for a touchdown)…graduated with a 3.66 GPA and degree in marketing (December 2017)…stamped his name in the Toledo receiving record books.","YEAR (GP/GS)     REC     YDS     AVG      TD      NOTES 2014: (13/0)     4       34      8.5      0 2015: (12/11)    37      825     22.3     5 2016: (13/13)    64      1,269   19.8     11      First Team All-MAC 2017: (5/5)      28      537     19.2     4       Medical Redshirt 2018: (13/13)    48      647     13.5     10      First Team All-MAC Total: (56/42)   181     3,312   18.3     30              HT      WT ARM         HAND WING 40-YD 20-YD 10-YD                        VJ        BJ        SS     3C       BP COMBINE     6014 205 31            09 3/8 74 5/8 4.57          2.66 1.61              38 1/2    09’11”    4.03   6.87     19 PRO DAY     N/A (stood on Combine numbers; positional drills only)                                                                                         [52]  ",13,13,.,.,.,.,.,.,.,.,.,.,48,647,13.479166666666666,10,.,.,.,.,.,.,31,9.375,74.625,4.57,2.66,1.61,38.5,119,4.03,6.87,19,2019,.,.,.,.,"ThomCo04"
"JONVEA JOHNSON","WR","Toledo",7,"12/23/1995","23.35","rSR",71.125,191,"Gary, Ind.","West Side",3,"A three-star wide receiver recruit out of high school, Jon’Vea (JOHN-vay) Johnson lettered in basketball, football and track at West Side, finishing third in the 100 meters at the 2013 state finals. After posting 1,054 receiving yards as a junior, he collected 73 catches for 1,428 yards and 23 touchdowns as a senior, earning First Team All-State honors. Johnson ranked as the No. 154 receiver nationally and the No. 14 recruit in the state of Indiana, receiving mostly MAC offers and committing to Toledo. His father (Jason), who coached him at West Side, was a wide receiver at Illinois State and played three seasons in the NFL. Johnson’s cousin (Lonnie) played cornerback at Kentucky and is a draftable prospect in the 2019 NFL Draft class. He accepted his invitation to the 2019 NFLPA Collegiate Bowl.","Accelerates in a blink, quickly finding his top speed…stacks cornerbacks and sustains his pace vertically to get behind the defense (his career 18.1 yards per catch ranks third best in school history)…quick feet to evade press and gain initial leverage…elusive with the ball in his hands, turning slants, screens or crossers into chunk plays…well-liked by his teammates and coaches…steady production the last three seasons despite a crowded wide receiver depth chart.","YEAR (GP/GS)     REC    YDS     AVG      TD      NOTES 2014: (1/0)      1      1       1.0      0       Redshirted 2015: (12/0)     8      101     12.6     0 2016: (13/11)    40     773     19.3     10      Second Team All-MAC 2017: (14/2)     42     689     164      5 2018: (13/2)     32     660     20.6     9       Third Team All-MAC Total: (53/15)   123    2,224   18.1     24              HT      WT ARM             HAND     WING      40-YD 20-YD 10-YD          VJ        BJ        SS     3C       BP COMBINE     N/A (not invited) PRO DAY     5111 191 31 3/8            08 7/8   76 1/2    4.39     2.58    1.52      35        10’08”    4.17   6.68     12  ",13,2,.,.,.,.,.,.,.,.,.,.,32,660,20.625,9,.,.,.,.,.,.,.,.,.,.,.,.,.,.,.,.,.,.,.,.,.,.,.
"PRESTON WILLIAMS","WR","Colorado State",11,"3/27/1997","22.09","rJR",76.25,211,"Lovejoy, Ga.","Lovejoy",4,"A four-star wide receiver recruit out of high school, Preston Williams was a football and track standout at Lovejoy, lining up as a receiver, returner and defensive back. He earned Offensive Player of the Year honors as a junior with 56 catches for 1,402 yards (25.0 average) and 14 touchdowns in 2013, adding three punt returns and two interceptions. Williams tallied 43 receptions for 916 yards and 13 scores as a senior before suffering a season-ending knee injury. He was the 2013 Georgia state champion in the long jump (24-2.5) and the runner-up in the triple jump. Ranked as the No. 7 receiver in the 2015 recruiting class, Williams held offers from every major program in the southeast and committed to Tennessee over Alabama, Auburn and Georgia (he was asked to leave an Auburn recruiting visit for being disruptive). He was ruled eligible in 2015 after retaking the ACT weeks before the season started. Midway through the 2016 season, Williams elected to leave the program and later signed with Colorado State (head coach Mike Bobo recruited him while he was a coordinator at Georgia), sitting out the 2017 season due to transfer rules. He also found off-field trouble after he enrolled and was suspended from the football program following a September 2017 arrest. Williams rejoined the team prior to the 2018 season and put together a strong junior year, deciding to leave early for the 2019 NFL Draft. He wasn’t invited to the 2019 NFL Scouting Combine due to his past off-field issues.","Athletic, rangy frame with a sizable wingspan…long, easy strides to stack corners and win vertical routes…fluid body type to sink and burst at route breaks…finds his top speed quickly to release and get cornerbacks off balance…limber body type to track, adjust and finish throws away from his frame, expanding his catch radius…terrific leaping skills to play in the clouds…flashes after-the-catch athleticism to shake defenders and run away from pursuit…productive final season in college with receiving numbers that rank top-three in Colorado State history for a single season.","YEAR (GP/GS) REC YDS             AVG      TD      NOTES 2015: (8/1)     7       158      22.6     2       Tennessee 2016: (4/2)     9       89       9.9      0       Tennessee 2017: Sat out due to transfer rules               Colorado State 2018: (12/10) 96        1,345 14.0        14      Colorado State; First Team All-MWC Total: (24/13) 112 1,592 14.2             16              HT      WT ARM              HAND     WING     40-YD 20-YD 10-YD          VJ        BJ        SS     3C       BP COMBINE     N/A (not invited) PRO DAY     6042 211 33                 09 1/8   79 3/4   4.59     2.77    1.65      31 1/2    09’08”    4.35   7.11     -     (no bench – right shoulder)  ",12,10,.,.,.,.,.,.,.,.,.,.,96,1345,14.010416666666666,14,.,.,.,.,.,.,.,.,.,.,.,.,.,.,.,.,.,.,.,.,.,.,.
"JAZZ FERGUSON","WR","Northwestern St.",1,"1/12/1997","22.30","rJR",76.625,227,"St. Francisville, La.","West Feliciana",4,"A four-star wide receiver recruit out of high school, Jazmond “Jazz” Ferguson was a four-year starter in three sports at West Feliciana, starring in basketball, football and track. He averaged 14.5 points and 8.0 rebounds per game on the hardcourt and was a district champion in the long jump (22-10) and 200 meters (22.61). On the football field, Ferguson posted 889 receiving yards and 10 touchdown catches as a senior, adding 561 rushing yards and seven scores on the ground. On defense, he tallied 87 tackles and four interceptions. Ferguson was the No. 12-ranked recruit in Louisiana and the No. 36 receiver nationally, committing to in-state LSU. He spent two seasons in Baton Rouge before his academics slipped and he struggled to find the field. Ferguson transferred to FCS-level Northwestern State and sat out the 2017 season to get his grades in order. After an All-American 2018 campaign, he decided to skip his senior year and enter the 2019 NFL Draft. Ferguson’s older brother (Jaylon) is the NCAA all-time sack leader and also an NFL prospect in the 2019 draft class.","Impressive size/speed athlete…huge catch radius with his leaping skills and wingspan to play in the clouds…judges the ball well in flight to time his attack, making acrobatic catches over defenders…tracks well over his shoulder…long strider and closes cushions in a flash…plant-and-drive burst on one-cut vertical patterns…uses his physicality and length to detach from sticky coverage…subtly wipes defender’s hands away in his release…highly productive 2018 season, leading the conference in catches and receiving yards.","YEAR (GP/GS) REC YDS             AVG      TD      NOTES 2015: (2/0)      0      0        0.0      0       LSU 2016: (7/1)      2      17       8.5      0       LSU 2017: Sat out as a transfer student               Northwestern State 2018: (11/11) 66        1,117 16.9        13      Northwestern State; First Team All-American; First Team All-Southland Total: (20/12) 68       1,134 16.7        13              HT       WT     ARM         HAND     WING     40-YD 20-YD 10-YD          VJ        BJ        SS     3C       BP COMBINE     6045     227    34 1/4      09 1/4   81 1/2   4.45  2.60  1.57           37        10’03”    4.59   7.25     8 PRO DAY                                                   -     -     -              -         10’01”    4.38   7.19     -     (stood on Combine runs, vertical, bench)  ",11,11,.,.,.,.,.,.,.,.,.,.,66,1117,16.924242424242426,13,.,.,.,.,.,.,34.25,9.25,81.5,4.45,2.6,1.57,37,123,4.59,7.25,8,2019,.,.,.,.,"FergJa04"
"KELVIN MCKNIGHT","WR","Samford",6,"4/25/1997","22.01","SR",68.125,185,"Bradenton, Fla.","Manatee",5,"A five-star cornerback recruit out of high school, Kelvin McKnight played football and ran track at Manatee where he was teammates with former Florida State defensive tackle Demarcus Christmas. Over his career, he led Manatee to four straight regional championships, winning the 2011 state title. As a senior, McKnight recorded 55 catches for 880 yards and nine touchdowns, finishing his career with 121 receptions for 1,751 yards and 23 total touchdowns. Ranked as the No. 227 receiver nationally in the 2015 recruiting class, he received several FBS-level offers (Florida Atlantic, Maryland, Troy), but committed to FCS-level Samford. His cousin (Peter Warrick) was an All-American at Florida State and the No. 4 overall pick in the 2000 NFL Draft; his cousin (Ace Sanders) was an All-SEC receiver at South Carolina and a fourth-round pick in the 2013 NFL Draft.","Lightning quick feet to explode out of his breaks…better route speed than timed speed, maintaining leverage to create late separation…shifts his gears mid-pattern with flashes of suddenness to stack corners and get behind the defense…outstanding hand-eye coordination at the catch point…elastic body type to make diving grabs look simple…expands his vision as a ball carrier to skirt defenders with lateral shake…doesn’t lack for toughness or grit…experienced punt returner, averaging 8.7 yards over his career with one score (74/643/1)…increased production each of his four seasons, (100-plus yards in 10 of Samford’s 11 games in 2018).","YEAR (GP/GS)     REC    YDS     AVG      TD      NOTES 2015: (11/10)    57     616     10.8     2       SoCon Freshman of the Year 2016: (11/9)     70     896     12.8     9       Second Team All-SoCon 2017: (11/11)    86     1,179   13.7     12      First Team All-American; First Team All-SoCon 2018: (11/11)    100    1,453   14.5     9       First Team All-American; First Team All-SoCon Total: (44/41)   313    4,144   13.2     32              HT      WT ARM             HAND     WING      40-YD 20-YD 10-YD          VJ        BJ       SS      3C      BP COMBINE     N/A (not invited) PRO DAY     5081 185 31                09 5/8   74        4.62    2.64     1.66      39 1/2    10’00”   4.24    6.98    8  ",11,11,.,.,.,.,.,.,.,.,.,.,100,1453,14.53,9,.,.,.,.,.,.,.,.,.,.,.,.,.,.,.,.,.,.,.,.,.,.,.
"TERRY GODWIN","WR","Georgia",5,"10/23/1996","22.52","SR",71.375,184,"Hogansville, Ga.","Callaway",5,"A five-star athlete recruit out of high school, Terry Godwin Jr. was a three-sport athlete at Callaway, playing baseball, basketball and football. He spent most of his time at wide receiver and cornerback while also adding quarterback and return man to his list of duties. He was considered the No. 1 athlete recruit in the country and was recruited on both sides of the ball. Godwin considered offers from Alabama, Auburn and USC before deciding to stay close to home and sign with Georgia, which recruited him as an offensive-only player. Following his high school graduation, he was drafted by the Atlanta Braves in the 33rd round of the 2015 MLB Draft but didn’t sign. Godwin accepted his invitation to the 2019 East-West Shrine Game.","Excellent start/stop athleticism and able to decelerate in a blink…strong cuts off his plant foot, gashing defenses on slants and crossers…impressive ball skills and hand-eye coordination to make difficult catches (see one-handed touchdown on 2017 Notre Dame tape)…excellent spatial awareness before and after the catch to create…gains proper depth to drive corners off routes…fearless over the middle and tougher than he looks…reliable football and personal character (Teammate Isaac Nauta: “He’s always got the best attitude”).","YEAR (GP/GS)     REC    YDS     AVG      TD      NOTES 2015: (13/9)     35     379     10.8     2 2016: (13/4)     38     397     10.4     0 2017: (15/14)    38     639     16.8     6 2018: (13/9)     22     373     17.0     3 Total: (54/36)   133    1,788   13.4     11              HT      WT ARM         HAND WING 40-YD 20-YD 10-YD                       VJ        BJ       SS      3C      BP COMBINE     5113 184 30            09 3/8 73 7/8 4.55          2.67 1.60             36 1/2    09’09”   -       6.96    -     (no shuttle or bench – choice) PRO DAY     N/A (stood on Combine numbers; positional drills only)  ",13,9,.,.,.,.,.,.,.,.,.,.,22,373,16.954545454545453,3,.,.,.,.,.,.,30,9.375,73.875,4.55,2.67,1.6,36.5,117,.,6.96,.,2019,2019,"Carolina Panthers",7,237,"GodwTe00"
