"Name","position","college","jersey_number","birthday","age","coll_class","height","weight","hs_loc","hs_name","HS_recruitment","background_info","strengths","stats","GP","GS","pass_comp","pass_att","comp_pct","pass_yds","pass_td","qb_int","rush_att","rush_yds","rush_ypc","rush_TD","rec","rec_yds","rec_ypc","rec_TD","tackles","tfl","sacks","forced_fumbles","passes_defended","def_int","arm_length","hand_size","wingspan","forty_dash","twenty_shuttle","ten_split","vert_jump","broad_jump","short_shuttle","three_cone","bench","season","draft_year","draft_team","draft_round","draft_ovr","pfr_id"
"JOSH ALLEN","EDGE","Kentucky",41,"7/13/1997","21.80","SR",76.875,262,"Montclair, N.J.","Montclair",2,"A two-star linebacker recruit out of high school, Joshua “Josh” Allen grew up in New Jersey, but crowded living conditions at home and the desire for a fresh start (diagnosed with ADHD) led him to Alabama after middle school, moving in with his aunt and uncle. He preferred basketball, but also tried out for football at Abbeville High School, developing into a First Team All-State wide receiver as a junior with 1,150 yards and 11 touchdowns. With his sisters leaving home for college, Allen returned to Montclair for his senior year where he transitioned to defense, also seeing snaps at wide receiver. He helped lead Montclair to an undefeated 2014 season, including a third-straight state title, finishing his senior year with a state-best 22.5 sacks. With the move to New Jersey and the transition to defensive end, Allen fell through the cracks as a college recruit. His only FBS scholarship offer was from Buffalo, but he committed to FCS-level Monmouth due to its proximity. In the final days prior to signing day, Kentucky had a few decommitments and thanks to persistence from his high school head coach (John Fiore), Kentucky visited Montclair as they were scrambling to fill out their recruiting class. They offered him on the spot and Allen visited campus the next day, committing to the Wildcats. Allen is one of six kids, including his fraternal twin brother (Isaiah). His older sister (Myisha Hines-Allen) played basketball at Louisville and currently plays for the WNBA’s Washington Mystics. His older sister (LaTorri Hines-Allen) played basketball at Virginia Tech. His uncle (Gregory Hines) was a standout basketball player at Hampton (1979-83) before he was a fifth-round pick in the 1983 NBA Draft, playing 12 years in various professional leagues. Allen has a one-year old son (Wesley) with his girlfriend. He originally accepted his invitation to the 2019 Senior Bowl, but later pulled out of the event.","Excellent first step to win the corner with a simple speed rush…expanded his pass rush repertoire each season at Kentucky…long-armed frame with a large wingspan and developed muscle tone (added 50-plus pounds since arriving at Kentucky, including 20 pounds between his junior and senior seasons)…forces holding penalties with his ability to work through the shoulder of blockers…plays with closing burst to close the gap in pursuit…loose athlete in space…stays stride- for-stride with backs and tight ends in coverage…intelligent, alert player to see plays develop pre-snap…voted a team captain in 2018…performance doesn’t fall off late in games (13 of his 17 sacks in 2018 came in the second half)…holds the school records for sacks in a single season (17.0) and career (31.5) – his career sack total ranks ninth-best in SEC history, just a half sack behind Reggie White (32)…he is tied with Danny Trevathan for the school record in career forced fumbles (11).","YEAR (GP/GS)     TKLS   TFL     SACK     FF   PD    INT     NOTES 2015: (12/0)     4      1.5     0.5      0    1     0 2016: (13/9)     62     8.5     7.0      4    0     0 2017: (13/13)    65     9.5     7.0      2    4     1 2018: (13/13)    88     21.5    17.0     5    4     0       Bronko Nagurski Award; Chuck Bednarik Award; Consensus All-American; SEC Defensive Player of the Year Total: (51/35)   219    41.0    31.5     11   9     1               HT      WT ARM         HAND WING 40-YD 20-YD 10-YD                         VJ        BJ        SS     3C       BP COMBINE      6047 262 33 1/2 08 3/4 80 1/2 4.63              2.70 1.63                  -         09’10”    4.23   7.15     28    (no vertical – choice) PRO DAY      N/A (stood on Combine numbers; no workout – choice)  ",13,13,.,.,.,.,.,.,.,.,.,.,.,.,.,.,88,21.5,17,5,4,0,33.5,8.75,80.5,4.63,2.7,1.63,.,118,4.23,7.15,28,2019,2019,"Jacksonville Jaguars",1,7,"AlleJo03"
"MONTEZ SWEAT","EDGE","Mississippi State",9,"9/4/1996","22.65","rSR",77.75,260,"Stone Mountain, Ga.","Stephenson",3,"A three-star tight end recruit out of high school, Shaquan Montez Sweat, who was raised by his grandparents, was a standout in football and basketball at Stephenson. Averaging 12.3 points and 8.1 rebounds as a senior, he also received college basketball offers. On the football field, Sweat was better known as a tight end who would occasionally rush the passer — he was considered a top-60 tight end recruit in the country. He initially committed to Vanderbilt before flipping to Michigan State (over Florida State) with the Spartans wanting to move him to defense full-time. Sweat played in two games in 2014 before taking a redshirt year. He was suspended most of 2015 for a violation of team rules and left the program the following spring (April 2016) for “personal reasons.” After one season at the JUCO level, Sweat was a highly sought-after recruit and committed to Mississippi State over LSU and Texas A&M. He accepted his invitation to the 2019 Senior Bowl.","NFL frame and length…light-footed out of his stance with long strides to quickly eat up grass…core flexibility to lean and maintain his balance…forceful long-arm and introduces various inside/outside moves to keep blockers guessing…improved run awareness and play identification…able to retrace and find the ball…efficient changing directions when tracking the run…comfortable on his feet, dropping in space and covering ground with his long strides…emotional player and not afraid to throw the first punch…effort sustains all four quarters…reached double-digit sacks in both of his seasons in the SEC.","YEAR (GP/GS) TKLS TFL SACK FF               PD    INT    NOTES 2014: (2/0)     4      0.5  0.5     0       0     0      Michigan State; Redshirted 2015: (2/0)     0      0.0  0.0     0       0     0      Michigan State 2016: Copiah-Lincoln Community College 2017: (13/13) 48       15.5 10.5    0       0     0      Mississippi State; First Team All-SEC; Led SEC in sacks and tackles for loss 2018: (13/12) 53       14.0 11.5    1       0     0      Mississippi State; First Team All-American; First Team All-SEC Total: (30/25) 105 30.0 22.5        1       0     0              HT      WT ARM         HAND WING 40-YD 20-YD 10-YD                      VJ        BJ        SS      3C      BP COMBINE     6056 260 35 3/4 10 1/2 84 3/4 4.41                 2.57 1.54            36        10’05”    4.29    7.00    21 PRO DAY     N/A (stood on Combine numbers; positional drills only)  ",13,12,.,.,.,.,.,.,.,.,.,.,.,.,.,.,53,14,11.5,1,0,0,35.75,10.5,84.75,4.41,2.57,1.54,36,125,4.29,7,21,2019,2019,"Washington Redskins",1,26,"SweaMo00"
"BRIAN BURNS","EDGE","Florida State",99,"4/23/1998","21.02","JR",76.75,249,"Fort Lauderdale, Fla.","American Heritage",4,"A four-star defensive end recruit out of high school, Brian Burns transferred from Davie University School to American Heritage after his sophomore season and put his name on the recruiting map. He helped lead American Heritage to the 2014 state championship and earned player of the year honors in 2015, finishing his senior season with 65 tackles and 16.0 sacks. Burns was rated as a top-50 recruit in the country and committed to Florida State over Georgia and Florida on signing day. He decided to skip his senior season with the Seminoles and enter the 2019 NFL Draft.","Twitchy get-off and lateral movements…runs the arc with speed…natural body control to capture the corner and flatten to the quarterback…angular body type with long arms to stab or club-rip blockers…plays with bend and skillfully regains his balance mid-rush…able to change directions with little wasted movement…displays the foot agility and long strides to cover ground and play in space…uses his length to find passing lanes…blocked three kicks over his career…voted a team captain in 2018 and his FSU coaches call him a “humble hustler” who gives “consistent effort” in practice…started every game the past two seasons and played through injuries…his 24.0 career sacks rank fifth in school history.","YEAR (GP/GS)     TKLS   TFL     SACK   FF   PD    INT    NOTES 2016: (13/0)     24     10.5    9.5    1    0     0      Freshman All-American; Led all FBS freshman in sacks; most sacks by FSU freshman since 1977 2017: (13/13)    48     13.5    4.5    3    4     0 2018: (12/12)    52     15.5    10.0   3    3     0      First Team All-ACC; Voted team MVP; Led the ACC in sacks per game (0.83); Team Captain Total: (38/25)   124    39.5    24.0   7    7     0              HT      WT ARM         HAND WING 40-YD 20-YD 10-YD                      VJ        BJ        SS      3C      BP COMBINE     6046 249 33 7/8 10             83 5/8 4.53         2.62 1.54            36        10’09”    -       7.01    -     (no shuttle or bench – choice) PRO DAY     N/A (stood on Combine numbers; positional drills only)  ",12,12,.,.,.,.,.,.,.,.,.,.,.,.,.,.,52,15.5,10,3,3,0,33.875,10,83.625,4.53,2.62,1.54,36,129,.,7.01,.,2019,2019,"Carolina Panthers",1,16,"BurnBr00"
"RASHAN GARY","EDGE","Michigan",3,"12/3/1997","21.41","JR",76.375,277,"Plainfield, N.J.","Paramus Catholic",5,"A five-star defensive end recruit out of high school, Rashan Gary started playing football in seventh grade and quickly created buzz with his performance at camps, receiving a scholarship offer from Rutgers before he reached high school. Living with his father in Scotch Plains, he spent his freshman and sophomore years at Scotch Plains-Fanwood High. He moved in with his mother (Jennifer Coney) in Plainfield after his father relocated (he doesn’t have a close relationship with his father). Gary transferred to powerhouse Paramus Catholic prior to his junior season, which caused controversy because of transfer rules, but he was ruled eligible prior to the 2014 season, earning New Jersey Defensive Player of the Year honors his junior and senior seasons. USA Today tabbed him as the National Defensive Player of the Year in 2015, finishing his senior season with 55 tackles and 13.5 sacks (and a 3.85 GPA). In the 2016 recruiting class, Gary was not only ranked as the No. 1 player in the state and the No. 1 player in the country, but also the No. 1 ranked recruit all-time according to 247 Composite Rankings (since 2000). He considered offers from Alabama, Auburn, USC and several others before choosing Michigan over Clemson on signing day, continuing the Paramus-to- Michigan pipeline that included Jabrill Peppers and Juwann Bushell-Beatty before him. Gary elected to skip his senior season and the bowl game to enter the 2019 NFL Draft. He also started his own sports agency: “Rashan Gary Sports.”","Gifted athlete for his size…flashes the explosive quickness and light feet of a much smaller player…flexible body type with oily hips to smoothly change directions…rare range…plays with low, balanced pad level…wins the corner with powerful strides…violent hands and effective long-arm move…physical edge setter…uses his length to lock out, shed and pursue…accustomed to dealing with chips, double-teams and extra attention…improved discipline to stay home and read the quarterback…competes with urgency…wants to be a leader and not shy joking around or pushing teammates.","YEAR (GP/GS)     TKLS   TFL    SACK    FF    PD     INT    NOTES 2016: (13/0)     27     5.0    1.0     0     0      0 2017: (13/13)    67     12.0   6.0     1     0      0      First Team All-Big Ten 2018: (9/9)      44     7.0    3.5     0     0      0      First Team All-Big Ten Total: (35/22)   138    24.0   10.5    1     0      0              HT      WT ARM         HAND           WING     40-YD 20-YD 10-YD          VJ       BJ        SS     3C       BP COMBINE     6043 277 34 1/8 09 5/8                81 7/8   4.58  2.67  1.61           38       10’00”    4.29   7.26     26 PRO DAY     N/A (no workout – choice)  ",9,9,.,.,.,.,.,.,.,.,.,.,.,.,.,.,44,7,3.5,0,0,0,34.125,9.625,81.875,4.58,2.67,1.61,38,120,4.29,7.26,26,2019,2019,"Green Bay Packers",1,12,"GaryRa00"
"CLELIN FERRELL","EDGE","Clemson",99,"5/17/1997","21.95","rJR",76.375,264,"Richmond, Va.","Benedictine",4,"A four-star defensive end recruit out of high school, Clelin (CLEE-lihn) Ferrell (FURR-ull) attended Benedictine College Prep, a private, all-boys school where he played football and basketball. He earned All-State honors as a junior in 2013 with 60 tackles, 26.0 tackles for loss and 11.5 sacks. Ferrell suffered a torn ACL days prior to the 2014 season, missing his senior year. He was ranked as a top-10 defensive end recruit in the country and a top-3 player in the state, narrowing down his college choice to Clemson, Florida State, Michigan, Michigan State, South Carolina, Tennessee and Virginia Tech. Ferrell committed to Clemson a few months prior to the ACL injury and the Tigers’ coaches stood by him despite the injury. His father (Cleavester Sr.) and mother (Faye) served a combined 46 years in the U.S. Army. His father, who passed away in 2012 from cancer, was a first sergeant who served two tours in Vietnam. Ferrell is the youngest of nine children. He elected to skip his final season of eligibility and enter the 2019 NFL Draft.","Good-looking on the hoof with long arms…advanced hand use, displaying strong rip, chop and swipe moves…times up the snap well with quick initial movements…understands depth and how to create rush lanes for himself…lower and upper body mechanics stay on the same page…effective spin and sets up inside moves…uses his length to set a hard edge and stay clean…holds his ground vs. power…disciplined eyes to read/track the football, staying away from mistakes…keeps his head on a swivel and anticipates angle blocks…consistent effort and plays through the whistle, making opposite hash stops…named a 2018 team captain…called a “humble worker” by his coaches…productive resume and started more games (44) than any other pass rusher in Clemson history, passing Levon Kirkland (43).","YEAR (GP/GS) TKLS       TFL    SACK    FF    PD     INT    NOTES 2015: Redshirted 2016: (15/15) 44        12.5   6.0     0     2      0 2017: (14/14) 66        18.0   9.5     2     1      0      First Team All-American; First Team All-ACC 2018: (15/15) 54        19.5   11.5    3     4      0      Consensus All-American; First Team All-ACC; ACC Defensive Player of the Year; Ted Hendricks Award Total: (44/44) 164      50.0   27.0    5     7      0              HT      WT ARM          HAND          WING     40-YD 20-YD 10-YD          VJ       BJ        SS     3C       BP COMBINE     6043 264 34 1/8 10 1/2                82 3/8   -     -     -              -        09’06”    4.40   7.26     25    (no runs or vertical – choice) PRO DAY     N/A (no workout – turf toe)                                                                                      [114]  ",15,15,.,.,.,.,.,.,.,.,.,.,.,.,.,.,54,19.5,11.5,3,4,0,34.125,10.5,82.375,.,.,.,.,114,4.4,7.26,25,2019,2019,"Oakland Raiders",1,4,"FerrCl00"
"JACHAI POLITE","EDGE","Florida",99,"3/30/1998","21.08","JR",74.625,258,"Daytona Beach, Fla.","Mainland",3,"A three-star defensive end recruit out of high school, Jachai (juh-KYE) Polite played both basketball (his first love) and football at Mainland. He played on both offense (tight end) and defense (pass rusher), but also saw snaps at quarterback, wide receiver, cornerback, linebacker, safety and punter throughout his prep career. Over his final two seasons in high school, Polite combined for 132 tackles, 49 tackles for loss and 23 sacks, earning All-State honors. He was the No. 33 defensive end in the 2016 recruiting class and committed to Florida over Auburn, Miami and USC. Polite was used as a three-technique defensive tackle before losing weight and moving to pass rusher his final two seasons. His Twitter handle (@RetireMoms) sums up his motivation. Polite elected to skip his senior season and enter the 2019 NFL Draft.","Quick first step and hits top speed immediately…explosive closing burst…covers a lot of ground and competes with a revving motor…fluid ankle flexion and dip to run the hoop…uses his explosive upper body (length and hands) to stun and maintain spacing with blockers…expanded his bag of tricks as a pass rusher, including an efficient spin and effective long-arm…nice job retracing his steps and chasing from the backside…matured play recognition to sniff out screens and string out runs…knack for punching the ball out, becoming the fourth player in Florida history with at least eight career forced fumbles (FBS-best six forced fumbles in 2018)…comfortable spot dropping and playing in space…non-stop hustler and makes plays away from the line of scrimmage…dropped 25-30 pounds prior to the 2018 season.","YEAR (GP/GS)     TKLS   TFL    SACK    FF      PD   INT   NOTES 2016: (12/0)     11     3.5    2.0     1       0    0 2017: (7/4)      22     5.5    2.0     1       0    0     Missed final four games with a shoulder injury 2018: (13/5)     45     17.5   11.0    6       4    0     Second Team All-American; First Team All-SEC; Led FBS in forced fumbles Total: (32/9)    78     26.5   15.0    8       4    0              HT       WT     ARM       HAND      WING      40-YD 20-YD 10-YD          VJ        BJ        SS     3C       BP COMBINE     6025     258    32 5/8    09 3/4    80 1/4    4.84  2.85  1.71           32        -         -      -        -    (no broad, shuttle or 3-cone – hamstring) PRO DAY              254                                  5.03  2.97  1.75           -         08’06”    -      7.59     14   (limited workout – right hamstring)  ",13,5,.,.,.,.,.,.,.,.,.,.,.,.,.,.,45,17.5,11,6,4,0,32.625,9.75,80.25,4.84,2.85,1.71,32,.,.,.,.,2019,2019,"New York Jets",3,68,"PoliJa00"
"DANDRE WALKER","EDGE","Georgia",15,"1/23/1997","22.27","SR",74.375,251,"Fairburn, Ga.","Langston Hughes",4,"A four-star defensive end recruit out of high school, D’Andre Walker was a standout at Langston Hughes in Fairburn, an Atlanta suburb. He posted 102 tackles, 29.0 tackles for loss and 23.5 sacks his senior season, earning First Team All-State honors. Considered a top-15 recruit in the state of Georgia, Walker narrowed his college choice to Auburn, Georgia and Tennessee, using a stuffed Bulldog to announce his commitment at the U.S. Army All-American Game. He accepted his invitation to the 2019 Senior Bowl, but was unable to play due to a groin injury.","Gains ground with his first step…speed to reach and wrap the corner…flexible rusher with low pad level and natural balance to work off contact…flexible ankles to skim, stunt and loop, helping open pass rush lanes…determined chaser from the backside…power to go through running back blocks like a bullet through paper…budding recognition skills to adjust mid-rush…comfortable dropping in zones to cover digs and crossers…extensive experience on special teams coverages…gives unquestioned effort and football is important to him (Georgia head coach Kirby Smart: “He’s a very motivated kid. He plays so hard”). z","YEAR (GP/GS)     TKLS   TFL     SACK    FF    PD    INT    NOTES 2015: (13/0)     9      0.5     0.5     0     0     0 2016: (13/0)     19     2.5     0.0     0     0     0 2017: (15/0)     40     13.5    5.5     1     1     0 2018: (13/13)    45     11.0    7.5     4     3     0      Led the team in tackles for loss, sacks and forced fumbles Total: (54/13)   113    27.5    13.5    5     4     0               HT      WT ARM         HAND          WING     40-YD 20-YD 10-YD           VJ         BJ        SS     3C       BP COMBINE      6023 251 34 3/8 09 7/8               81 3/4   -     -     -               -          -         -      -        -     (no workout – hernia) PRO DAY      N/A (no workout – hernia)  ",13,13,.,.,.,.,.,.,.,.,.,.,.,.,.,.,45,11,7.5,4,3,0,34.375,9.875,81.75,.,.,.,.,.,.,.,.,2019,2019,"Tennessee Titans",5,168,"WalkDA02"
"CHASE WINOVICH","EDGE","Michigan",15,"4/19/1995","24.03","rSR",74.75,256,"Jefferson Hills, Pa.","Thomas Jefferson",4,"A four-star linebacker recruit out of high school, Chase Winovich (WIN-o-vich) was a three-year starting linebacker at Thomas Jefferson in Jefferson Hills, which is a southern suburb of Pittsburgh. He posted 57 tackles, 13.0 sacks and three forced fumbles as a senior, finishing his prep career with 149 tackles, 22.0 sacks and one interception. Winovich also saw time at running back and added starting quarterback duties to his resume as a senior, recording 210 passing yards, 981 rushing yards and 20 total touchdowns. He also played basketball all four years at Thomas Jefferson. Winovich was the No. 24 rated linebacker in the 2014 recruiting class and committed to Michigan over Ohio State and Pittsburgh. He signed as a SAM linebacker, but was moved to tight end before moving back to defense and the defensive line as a junior. Winovich’s father (Peter) played basketball at Bethany College (1977-81); his mother (Nina) received the presidential fitness award; his older brother (Peter) played tight end at Bowling Green. Winovich accepted his invitation to the 2019 Senior Bowl, but was unable to participate due to a foot injury.","Times the snap well and finishes with closing burst…arc speed and flexibility to win the corner…violent swipe and effort allow him to stay unattached mid-rush…his tape is a clinic of chasing down plays from the backside…competes with consistent play speed through the whistle…matured play recognition and nose for the ball…balanced in space…drops his pads and drives through his target as a tackler…toughness isn’t a question mark and plays through pain…crazy competitive drive and won’t take a snap off, playing with a touch of insanity to him…consistent production as a starter.","YEAR (GP/GS) TKLS       TFL     SACK    FF    PD    INT    NOTES 2014: Redshirted 2015: (6/0)     2       0.0     0.0     0     0     0 2016: (13/2)    35      9.5     5.0     1     0     0 2017: (13/13) 77        18.0    8.0     2     0     0      Second Team All-Big Ten 2018: (13/13) 69        17.0    5.0     0     1     0      Second Team All-American; First Team All-Big Ten Total: (45/28) 183      44.5    18.0    3     1     0               HT      WT ARM         HAND WING 40-YD 20-YD 10-YD                        VJ         BJ        SS     3C       BP COMBINE      6026 256 32 3/4 10             78 1/2 4.59         2.69 1.57              30 1/2     09’08”    4.11   6.94     18 PRO DAY      N/A (stood on Combine numbers; positional drills only)  ",13,13,.,.,.,.,.,.,.,.,.,.,.,.,.,.,69,17,5,0,1,0,32.75,10,78.5,4.59,2.69,1.57,30.5,116,4.11,6.94,18,2019,2019,"New England Patriots",3,77,"WinoCh00"
"LJ COLLIER","EDGE","TCU",91,"9/12/1995","23.63","rSR",74.25,283,"Munday, Texas","Munday",3,"A three-star defensive end recruit out of high school, Lawrence “L.J.” Collier Jr. was a three-year starter at Munday where his family has a storied history in athletics. After earning All-District honors as a sophomore, he posted 77 tackles and 22.0 tackles for loss as a junior, earning Defensive MVP in the Division II State Championship victory. As a senior, Collier finished with 64 tackles, 15.0 tackles for loss and 3.0 sacks, also earning All-District honors as a tight end. He was the No. 53 defensive end in the 2014 recruiting class and initially committed to Texas Tech as a junior before flipping to TCU shortly before signing day. His twin uncles (Perry and Terry) played college football at Oklahoma. Collier accepted his invitation to the 2019 Senior Bowl.","Workable frame with outstanding length…assignment sound in the run game…stacks the point of attack with physical hands to work off blocks and find the ballcarrier…quick read/react ability and keeps the mental mistakes to a minimum…balanced in his move-to-move sequence with enough juice off the edge to tilt tackles…drops his pads, extends his reach and drives his legs to bully his way through blockers…competes with relentless hustle and a mean streak.","YEAR (GP/GS) TKLS       TFL    SACK     FF     PD    INT    NOTES 2014: Redshirted 2015: (4/0)     1       0.0    0.0      0      0     0 2016: (13/0)    21      4.5    4.5      0      1     0 2017: (14/0)    18      4.5    4.0      0      1     1 2018: (11/10) 42        11.5   6.0      0      4     0      First Team All-Big 12 Total: (42/10) 82       20.5   14.5     0      6     1              HT      WT ARM         HAND WING 40-YD 20-YD 10-YD                         VJ       BJ        SS     3C       BP COMBINE     6022 283 34            10      81 7/8 4.91         2.87 1.75               30       09’10”    4.78   7.71     25 PRO DAY     N/A (stood on Combine numbers; positional drills only)  ",11,10,.,.,.,.,.,.,.,.,.,.,.,.,.,.,42,11.5,6,0,4,0,34,10,81.875,4.91,2.87,1.75,30,118,4.78,7.71,25,2019,2019,"Seattle Seahawks",1,29,"CollLJ00"
